tipo_inmueble,finalidad,estado_inmueble,ubicacion_principal,ubicacion_asociada,area,habitaciones,baños,precio,estrato,antigüedad,administración,comodidades,descripcion,contacto,codigo,vendedor,link_venta,link_image,error
Casa,venta,Usado,"Tunja, Tunja, Boyaca","Tunja, San jose 000050, Maldonado",201.00  m2 m²,6,2,$450.000.000,3,más de 30 años,6 Habs.,", Instalación de gas, , Parques cercanos, , Patio, , Supermercados / C.Comerciales, , Trans. Público cercano, , Zona de lavandería, , Zona Residencial, Descripción, Casa amplia y Cálida de 201 M2 de area construida sobre un lote de 150 M2, consta de 2 pisos, piso 1 garaje, patio, sala, comedor, cocina, baño, 1 alcoba, piso 2 con 5 alcobas, 1 baño. Excelente ubicación cerca el centro de la ciudad de Tunja, sector tranquilo y seguro, cuenta con variedad de rutas de transporte urbano, Código Fincaraíz:, 191194633, Consultar, YB Inmobiliaria, Completa tus datos para habilitar los medios de contacto, +57, Aceptas nuestros","Casa amplia y Cálida de 201 M2 de area construida sobre un lote de 150 M2, consta de 2 pisos, piso 1 garaje, patio, sala, comedor, cocina, baño, 1 alcoba, piso 2 con 5 alcobas, 1 baño. Excelente ubicación cerca el centro de la ciudad de Tunja, sector tranquilo y seguro, cuenta con variedad de rutas de transporte urbano",,191194633,YB Inmobiliaria,https://www.fincaraiz.com.co/casa-en-venta/191194633,,
Apartamento,venta,Usado,"Tunja, Boyaca","Tunja, Santa ana, Los muiscas",113.00  m2 m²,3,3,$295.000.000,3,16 a 30 años,,", Cerca centro comercial, , Chimenea, , Closet, , Cocina Integral, , Duplex, , Instalación de gas, , Piso en Baldosa /  Mármol, , Terraza, , Trans. Público cercano, Descripción, ¡Atos Inmobiliaria tiene para ti este espectacular apartamento en el norte de la ciudad! Ubicado cerca de la Universidad de Boyacá y colegios, con acceso a una vibrante zona comercial. Disfruta de espacios amplios y modernos con tres habitaciones, tres baños, sala-comedor, cocina integral y una terraza ideal para tu descanso. Además, cuenta con dos parqueaderos descubiertos. No dejes pasar esta oportunidad de inversión o vivienda. ¡Agenda tu cita hoy mismo!, Código Fincaraíz:, 192180791, Consultar, ATOS Inmobiliaria SAS, Completa tus datos para habilitar los medios de contacto, +57, Aceptas nuestros","¡Atos Inmobiliaria tiene para ti este espectacular apartamento en el norte de la ciudad! Ubicado cerca de la Universidad de Boyacá y colegios, con acceso a una vibrante zona comercial. Disfruta de espacios amplios y modernos con tres habitaciones, tres baños, sala-comedor, cocina integral y una terraza ideal para tu descanso. Además, cuenta con dos parqueaderos descubiertos. No dejes pasar esta oportunidad de inversión o vivienda. ¡Agenda tu cita hoy mismo!",,192180791,ATOS Inmobiliaria SAS,https://www.fincaraiz.com.co/apartamento-en-venta/192180791,,
Casa,venta,Usado,"Tunja, Boyaca","Libertador, Bolivar, Tunja",123.00  m2 m²,3,2,$180.000.000,2,16 a 30 años,,", Acceso Pavimentado, , Baño Auxiliar, , Cerca de Zona Urbana, , Cocina Equipada, , Comedor auxiliar, , Hall de Alcobas, , Jardín, , Piso en Baldosa /  Mármol, , Trans. Público cercano, , Vista panorámica, , Zona de lavandería, , Zona Residencial","Código:899FR1142 Excelente oportunidad de adquirir casa a un precio muy asequible en la ciudad de Tunja, con fácil acceso de transporte público; la casa consta de tres alcobas con closet, dos baños, cocina semi integral, sala-comedor, amplia zona de lavandería y parqueadero para moto.",Código Fincaraíz:,192265733,Casa 360,https://www.fincaraiz.com.co/casa-en-venta-en-tunja/192265733,,
Casa,venta,Usado,"Centro, Tunja, Boyaca","Centro, Tunja, El milagro",385.00  m2 m²,6,3,$1.200.000.000,4,¡Pregúntale!,,,"VENDO ESPECTACULAR CASA EN EL CENTRO DE TUNJA,  REMODELADA.. diferentes ambientes,  para oficinas,  consultorios,  entidad financiera,  baños  de hombres,  mujeres,  zona de cocina.  Frente:   Fondo:Area:385m2 ....",,5943777,Inmobiliaria Fenix,https://www.fincaraiz.com.co/casa-en-venta/5943777,,
Apartamento,venta,Usado,"Tunja, Tunja, Boyaca","Tunja, Centro historico, Las nieves",85.00  m2 m²,3,2,$260.000.000,3,9 a 15 años,,", Baño Auxiliar, , Circuito cerrado de TV, , Citófono, , Cocina Integral, , Cocina tipo Americano, , Colegios / Universidades, , Parqueadero Visitantes, , Piso en Baldosa /  Mármol, , Portería / Recepción, , Salón Comunal, , Sobre vía principal, , Supermercados / C.Comerciales",Vendo amplio apartamento sector centro de la ciudad de Tunja.,,191932130,SUITES INMOBILIARIA,https://www.fincaraiz.com.co/apartamento-en-venta/191932130,,
Lote,venta,Usado,"Tunja, Boyaca","Tunja, Los patriotas","5,000.00  m2 m²",¡Pregúntale!,¡Pregúntale!,$4.500.000.000,3,1 a 8 años,,", Trans. Público cercano, , Vista panorámica, , Zona Residencial, , Área Urbana, Descripción, VENDO LOTE ESQUINERO, EXCLUSIVO DE 5000 M2, UBICADO EN SECTOR DE DESARROLLO EN EL ORIENTE DE TUNJA","VENDO LOTE ESQUINERO, EXCLUSIVO DE 5000 M2, UBICADO EN SECTOR DE DESARROLLO EN EL ORIENTE DE TUNJA",,191273745,ATOS Inmobiliaria SAS,https://www.fincaraiz.com.co/lote-en-venta/191273745,,
Casa,venta,Usado,"Las nieves, Tunja, Boyaca","San jose 000050, Tunja, Las nieves",500.00  m2 m²,17,7,$694.000.000,3,más de 30 años,,", Acceso Pavimentado, , Baño Auxiliar, , Calentador, , Cerca de Zona Urbana, , Closet, , Cochera, , Garaje(s), , Hall de Alcobas, , Instalación de gas, , Parques cercanos, , Piso en Baldosa /  Mármol, , Trans. Público cercano","Código:  899FR1154 Excelente oportunidad de adquirir esta espectacular casa rentable con tres apartamentos totalmente independientes y un aparta estudio a pocas cuadras del centro de la ciudad, con fácil acceso de transporte público, cerca de la Facultad de medicina, Hospital San Rafael, Universidad Antonio Nariño y prestigiosos colegios de la ciudad, los apartamentos están distribuidos así: el primer piso cuenta con garaje con habitación o local comercial, deposito, dos apartamentos totalmente independientes, uno con tres habitaciones, tres baños, cocina integral, sala-comedor y patio de ropas, dentro de este apartamento se encuentra un aparta estudio con mesanin, el otro apartamento se compone de ocho habitaciones, dos baños, sala-comedor,  cocina y zona de lavandería, en el segundo piso se encuentra un apartamento con cinco habitaciones de las cuales tres tienen closet, dos baños, sala-comedor, cocina integral, zona de lavandería y patio amplio,  la casa renta un promedio de cinco millones quinientos mil pesos.",Código Fincaraíz:,192265191,Casa 360,https://www.fincaraiz.com.co/casa-en-venta-en-las-nieves-tunja/192265191,,
Casa,venta,Usado,"Los muiscas, Tunja, Boyaca","Tunja, Soamox, Los muiscas",160.00  m2 m²,5,3,$380.000.000,3,más de 30 años,,", Baño Auxiliar, , Cocina Integral, , Colegios / Universidades, , Estudio, , Garaje(s), , Instalación de gas, , Patio, , Sobre vía principal, , Supermercados / C.Comerciales, , Trans. Público cercano, , Zona Comercial, , Zona de lavandería","Casa con excelente ubicación. Con gran proyección de inversión. Ubicada al norte de la ciudad, en sector comercial del barrio Los Muiscas, residencial, estudiantil, y además cerca a la Clínica Medilaser y Universidad de Boyacá.",,191706833,ENTORNO URBANO,https://www.fincaraiz.com.co/casa-en-venta/191706833,,
Finca,venta,Usado,"Tunja, Tunja, Boyaca","Tunja, Centro historico",22.00  m2 m²,1,1,$140.000.000,3,¡Pregúntale!,,", Baños Públicos, , Citófono, , Cómodas vias de acceso, , Parques cercanos, , Piso en Baldosa /  Mármol, , Portería / Recepción, , Servicios Públicos, , Sobre vía secundaria, , Ubicada en edificio, , Zona Comercial, , Zona Residencial, Descripción, Consultorio Odontológico frente al Hotel Hunza. Cuenta con: Sala de espera y servicio de personal de Recepción, Área de esterilización, Cuarto de disposición de basuras y servicio de compresor incluido para la unidad, Servicio de energía, agua e internet incluido. Ubicado en centro médico y odontológico, ambiente profesional con excelente crecimiento, Localizado en el centro de la ciudad., Código Fincaraíz:, 10148376, Consultar, ENTORNO URBANO, Completa tus datos para habilitar los medios de contacto, +57, Aceptas nuestros","Consultorio Odontológico frente al Hotel Hunza. Cuenta con: Sala de espera y servicio de personal de Recepción, Área de esterilización, Cuarto de disposición de basuras y servicio de compresor incluido para la unidad, Servicio de energía, agua e internet incluido. Ubicado en centro médico y odontológico, ambiente profesional con excelente crecimiento, Localizado en el centro de la ciudad.",,10148376,ENTORNO URBANO,https://www.fincaraiz.com.co/consultorio-en-venta/10148376,,
Apartamento,venta,Usado,"Tunja, Boyaca",Tunja,56.00  m2 m²,3,2,$180.000.000,2,1 a 8 años,3 Habs.,", Cocina Integral, , Piso en Baldosa /  Mármol, , Vista panorámica, , Zona Residencial, , Área Urbana, Descripción, ¡No pierdas la oportunidad de estrenar este hermoso apartamento! Este inmueble cuenta con excelentes acabados y una distribución muy funcional. Dispone de tres habitaciones amplias y dos baños completos, así como una sala comedor bien iluminada y una cocina integral moderna y equipada.","¡No pierdas la oportunidad de estrenar este hermoso apartamento! Este inmueble cuenta con excelentes acabados y una distribución muy funcional. Dispone de tres habitaciones amplias y dos baños completos, así como una sala comedor bien iluminada y una cocina integral moderna y equipada.",Código Fincaraíz:,191273934,ATOS Inmobiliaria SAS,https://www.fincaraiz.com.co/apartamento-en-venta/191273934,,
Casa,venta,Usado,"Tunja, Boyaca","Tunja, 15 de mayo",98.00  m2 m²,3,2,$340.000.000,4,9 a 15 años,3 Habs.,", Acceso Pavimentado, , Ascensor, , Balcón, , Baño Auxiliar, , Baño Independiente, , Calentador, , Hall de Alcobas, , Instalación de gas, , Parqueadero Visitantes, , Portería / Recepción, , Salón Comunal, , Sobre vía principal","Imagina despertar en un lugar lleno de luz natural, donde cada rincón transmite una sensación de tranquilidad y comodidad. Este apartamento en Tunja está diseñado para brindarte lo mejor de la vida urbana sin perder la serenidad que tu familia necesita. ?✨",,192339254,INMOBILIARIA LOS LANCEROS,https://www.fincaraiz.com.co/apartamento-en-venta/192339254,,
Lote,venta,Usado,"Tunja, Boyaca","Tunja, El paraiso, El cortijo",283.00  m2 m²,¡Pregúntale!,¡Pregúntale!,$240.000.000,3,1 a 8 años,,,Atos Inmobiliaria Vende Lote en el Barrio Paraíso - Ideal para Proyecto Residencial,Código Fincaraíz:,191273747,ATOS Inmobiliaria SAS,https://www.fincaraiz.com.co/lote-en-venta/191273747,,
Apartamento,venta,Usado,"Tunja, Boyaca","Tunja, Santa ana, Los muiscas",107.00  m2 m²,3,2,$464.000.000,5,menor a 1 año,,,¡Tu nuevo hogar te espera en el exclusivo sector Norte en Tunja!,,191272712,ATOS Inmobiliaria SAS,https://www.fincaraiz.com.co/apartamento-en-venta/191272712,,
Casa,venta,Usado,"Tunja, Boyaca","Maldonado, Tunja, Mesopotamia",240.00  m2 m²,4,4,$650.000.000,5,9 a 15 años,,", Amoblado, , Baño Auxiliar, , Calentador, , Citófono, , Cocina Integral, , Colegios / Universidades, , Parques cercanos, , Piscina, , Piso en Baldosa /  Mármol, , Salón Comunal, , Sobre vía principal, , Terraza","HERMOSA  CASA EN VENTA,  ubicada en el sector de la Av universitaria. área: 240 m2,  consta de tres niveles; primer nivel se encuentra estudio,  sala,  comedor,  cocina integral,  baño social,  cuarto de servicio con baño. segundo nivel tenemos 3 habitaciones,  una de ellas con baño y baño social; el tercer nivel cuenta con habitación ppal con baño,  estudio y gimnasio.  valor sin amoblar: 650.000.000 y valor de la casa amoblada: 750.000.000.",,7896504,INMOBILIARIA Y CONSTRUCTORA 2 MIL,https://www.fincaraiz.com.co/casa-en-venta/7896504,,
Apartamento,venta,Usado,"Tunja, Boyaca","Pozo donato, Univ pedag y tecno de colombia, Tunja",92.00  m2 m²,3,2,$360.000.000,4,9 a 15 años,3 Habs.,", Balcón, , Calentador, , Canchas Deportivas, , Citófono, , Cocina Integral, , Instalación de gas, , Piso de alta resistencia, , Tanques de Agua, , Trans. Público cercano, , Vista panorámica, , Zona Residencial, , Área Urbana, Descripción, Venta de Apartamento en el Norte de Tunja",Venta de Apartamento en el Norte de Tunja,Código Fincaraíz:,192262749,ATOS Inmobiliaria SAS,https://www.fincaraiz.com.co/apartamento-en-venta-en-tunja/192262749,,
Casa,venta,Usado,"Tunja, Boyaca","Maldonado, Tunja, Mesopotamia",235.00  m2 m²,4,4,$680.000.000,5,9 a 15 años,,", Balcón, , Baño Auxiliar, , Calentador, , Chimenea, , Citófono, , Cocina Integral, , Parques cercanos, , Piso en Baldosa /  Mármol, , Sobre vía principal, , Supermercados / C.Comerciales, , Terraza, , Trans. Público cercano",INMOBILIARIA 2 MIL VENDE CASA TERRAZAS SANTA INES,,10212752,INMOBILIARIA Y CONSTRUCTORA 2 MIL,https://www.fincaraiz.com.co/casa-en-venta/10212752,,
Apartamento,venta,Usado,"Tunja, Boyaca","Tunja, Los patriotas",78.28  m2 m²,3,2,$215.000.000,2,1 a 8 años,,", Baño Auxiliar, , Calentador, , Cocina Integral, , Colegios / Universidades, , Hall de Alcobas, , Instalación de gas, , Parques cercanos, , Patio, , Supermercados / C.Comerciales, , Trans. Público cercano, , Zona Residencial, , Zonas Verdes, Descripción, ¡Descubre tu nuevo hogar en el corazón de Tunja! Te presentamos este acogedor apartamento de 3 habitaciones y 2 baños, ubicado en el tranquilo y residencial barrio Los Patriotas. Este espacio es ideal para familias que buscan comodidad y cercanía a todos los servicios.","¡Descubre tu nuevo hogar en el corazón de Tunja! Te presentamos este acogedor apartamento de 3 habitaciones y 2 baños, ubicado en el tranquilo y residencial barrio Los Patriotas. Este espacio es ideal para familias que buscan comodidad y cercanía a todos los servicios.",Código Fincaraíz:,192018748,BOX HOUSE BIENES RAICES,https://www.fincaraiz.com.co/apartamento-en-venta/192018748,,
Casa,venta,Usado,"Tunja, Tunja, Boyaca","Tunja, Cr. la reserva campestre",419.00  m2 m²,3,4,$2.800.000.000,6,16 a 30 años,,", Balcón, , Chimenea, , Closet, , Cocina Equipada, , Instalación de gas, , Piso en Madera, , Terraza, , Vista panorámica, Descripción, Se vende: Exclusiva casa en el prestigioso Barrio La Villita, el sector más destacado de la ciudad. Con un lote de 1301.2 m2 y un área construida de 419.9 m2, esta propiedad es una verdadera joya. En el primer piso, encontrarás una amplia gama de comodidades, incluyendo un estudio, un baño social, un espacioso patio, sala de estar, comedor y cocina integral con una elegante barra. Además, cuenta con una cochera conectada a la casa principal.","Se vende: Exclusiva casa en el prestigioso Barrio La Villita, el sector más destacado de la ciudad. Con un lote de 1301.2 m2 y un área construida de 419.9 m2, esta propiedad es una verdadera joya. En el primer piso, encontrarás una amplia gama de comodidades, incluyendo un estudio, un baño social, un espacioso patio, sala de estar, comedor y cocina integral con una elegante barra. Además, cuenta con una cochera conectada a la casa principal.",Código Fincaraíz:,192273656,ATOS Inmobiliaria SAS,https://www.fincaraiz.com.co/casa-campestre-en-venta/192273656,,
Finca,venta,Usado,"Tunja, Boyaca","Tunja, Centro historico, El consuelo",13.00  m2 m²,¡Pregúntale!,¡Pregúntale!,$80.000.000,4,16 a 30 años,,,"Atos Inmobiliaria pone a la venta una oficina con una ubicación privilegiada en el centro de la ciudad, a tan solo dos cuadras de la plaza de Bolívar. Con un área de 13 m2, esta oficina ofrece una oportunidad única para aquellos que buscan establecer su negocio en una zona de alta demanda y excelente accesibilidad. Ya sea para un despacho profesional o una empresa emergente, esta oficina es ideal para quienes valoran la conveniencia y la visibilidad. ¡Contáctanos para más información y aprovecha esta oportunidad para invertir en un espacio comercial estratégico en el corazón de la ciudad!",Código Fincaraíz:,191272969,ATOS Inmobiliaria SAS,https://www.fincaraiz.com.co/oficina-en-venta/191272969,,
Finca,venta,Usado,"Tunja, Boyaca","Tunja, Centro historico, El consuelo",13.00  m2 m²,¡Pregúntale!,¡Pregúntale!,$80.000.000,4,16 a 30 años,,,"Atos Inmobiliaria pone a la venta una oficina con una ubicación privilegiada en el centro de la ciudad, a tan solo dos cuadras de la plaza de Bolívar. Con un área de 13 m2, esta oficina ofrece una oportunidad única para aquellos que buscan establecer su negocio en una zona de alta demanda y excelente accesibilidad. Ya sea para un despacho profesional o una empresa emergente, esta oficina es ideal para quienes valoran la conveniencia y la visibilidad. ¡Contáctanos para más información y aprovecha esta oportunidad para invertir en un espacio comercial estratégico en el corazón de la ciudad!",Código Fincaraíz:,191272987,ATOS Inmobiliaria SAS,https://www.fincaraiz.com.co/oficina-en-venta/191272987,,
Finca,venta,Usado,"Tunja, Boyaca","Tunja, Centro historico, Las nieves",17.00  m2 m²,¡Pregúntale!,¡Pregúntale!,$110.000.000,3,1 a 8 años,,,"Atos Inmobiliaria ofrece en arriendo un local u oficina en el Centro Comercial Paseo de la Salamandra, ubicado a dos cuadras de la Plaza de Bolívar. El espacio tiene un área de 17 m2 y está situado en el primer piso, local 117.",,192238523,ATOS Inmobiliaria SAS,https://www.fincaraiz.com.co/local-en-venta/192238523,,
Finca,venta,Usado,"Tunja, Boyaca","Tunja, Mesopotamia, Ub. el recreo",34.00  m2 m²,1,1,$240.000.000,5,9 a 15 años,1,", Ascensor, , Cerca centro comercial, , Citófono, , Trans. Público cercano, , Vista panorámica, , Zona Comercial, Descripción, ¡Tu negocio merece una ubicación privilegiada! Atos Inmobiliaria vende espectacular local esquinero sobre la avenida Olímpica, con excelente visibilidad y alto flujo de personas. Cuenta con baño privado, videocitófono y acceso por ascensor en edificio moderno y seguro. A solo pasos de la glorieta norte, rodeado de supermercados, clínicas, colegios y zonas comerciales. Perfecto para oficinas, consultorios o vitrinas. Una inversión inteligente en una zona de gran crecimiento. ¡No dejes pasar esta oportunidad y contáctanos hoy mismo!, Código Fincaraíz:, 192257993, Consultar, ATOS Inmobiliaria SAS, Completa tus datos para habilitar los medios de contacto, +57, Aceptas nuestros","¡Tu negocio merece una ubicación privilegiada! Atos Inmobiliaria vende espectacular local esquinero sobre la avenida Olímpica, con excelente visibilidad y alto flujo de personas. Cuenta con baño privado, videocitófono y acceso por ascensor en edificio moderno y seguro. A solo pasos de la glorieta norte, rodeado de supermercados, clínicas, colegios y zonas comerciales. Perfecto para oficinas, consultorios o vitrinas. Una inversión inteligente en una zona de gran crecimiento. ¡No dejes pasar esta oportunidad y contáctanos hoy mismo!",Código Fincaraíz:,192257993,ATOS Inmobiliaria SAS,https://www.fincaraiz.com.co/local-en-venta-en-tunja/192257993,,
Casa,venta,Usado,"Tunja, Boyaca","Tunja, Centro historico",130.00  m2 m²,4,3,$550.000.000,4,1 a 8 años,,", Canchas Deportivas, , Cerca centro comercial, , Citófono, , Closet, , Cocina Integral, , Salón Comunal, , Terraza, , Trans. Público cercano, , Vista panorámica, , Zona Comercial, , Zona Infantil, , Zona Residencial",Atos Inmobiliaria Vende Casa en Tunja,Código Fincaraíz:,191273491,ATOS Inmobiliaria SAS,https://www.fincaraiz.com.co/casa-en-venta/191273491,,
Casa,venta,Usado,"Tunja, Boyaca","Tunja, Cr. la reserva campestre",213.00  m2 m²,3,4,$2.300.000.000,6,menor a 1 año,,,"Atos Inmobiliaria ofrece en venta una exclusiva casa en el barrio La Villita al norte de la ciudad, recién construida y completamente amoblada. Esta impresionante propiedad está ubicada dentro de un conjunto cerrado, lo que garantiza seguridad y tranquilidad para ti y tu familia.",,191272996,ATOS Inmobiliaria SAS,https://www.fincaraiz.com.co/casa-en-venta/191272996,,
Apartamento,venta,Usado,"Tunja, Boyaca","Ub. parque de lidueña, Tunja, San ignacio",67.00  m2 m²,3,2,$357.000.000,4,9 a 15 años,3 Habs.,", Cerca centro comercial, , Closet, , Cocina tipo Americano, , Trans. Público cercano, , Zona Comercial, , Área Urbana, Descripción, ATOS INMOBILIARIA vende: Apartamento en Tunja",ATOS INMOBILIARIA vende: Apartamento en Tunja,Área total: 140 m²,191732985,ATOS Inmobiliaria SAS,https://www.fincaraiz.com.co/apartamento-en-venta/191732985,,
Apartamento,venta,Usado,"Tunja, Tunja, Boyaca","Tunja, Santa ana, Santa rita",110.00  m2 m²,3,3,$457.700.000,5,9 a 15 años,,", Ascensor, , Cocina Integral, , Instalación de gas, , Vista panorámica, , Zona Residencial, Descripción, Se Vende Hermoso Apartamento para ESTRENAR, consta de 3 habitaciones, dos de ellas cuentan con baño privado, baño auxiliar, sala comedor, cocina integral, zona de ropas y parqueadero cubierto. El Conjunto cuenta con Piscina, Sauna, Jacuzzi, Turco, Gimnasio, Salón Social, Parque Infantil, Zonas Verdes, Canchas Múltiples y Vigilancia 24 Horas,, Código Fincaraíz:, 191274093, Consultar, ATOS Inmobiliaria SAS, Completa tus datos para habilitar los medios de contacto, +57, Aceptas nuestros","Se Vende Hermoso Apartamento para ESTRENAR, consta de 3 habitaciones, dos de ellas cuentan con baño privado, baño auxiliar, sala comedor, cocina integral, zona de ropas y parqueadero cubierto. El Conjunto cuenta con Piscina, Sauna, Jacuzzi, Turco, Gimnasio, Salón Social, Parque Infantil, Zonas Verdes, Canchas Múltiples y Vigilancia 24 Horas,",,191274093,ATOS Inmobiliaria SAS,https://www.fincaraiz.com.co/apartamento-en-venta/191274093,,
Apartamento,venta,Usado,"Tunja, Tunja, Boyaca","Maldonado, Tunja, Mesopotamia",130.00  m2 m²,3,2,$420.000.000,5,¡Pregúntale!,,", En conjunto cerrado, , Portería / Recepción, , Zona Residencial, Descripción, Apartamento esquinero en el conjunto Ciudad Hayuelos de 95 m2 excelente vista a la ciudad con una iluminación y distribución increíble con un ambiente familiar 5 estrellas. Compuesto por 3 habitaciones con closet (Habitación principal con walking closet  y con baño privado adicional terraza, sala comedor con balcón con vista al norte Adicional doble parqueadero y deposito., Código Fincaraíz:, 192333565, Consultar, NC INTERNATIONAL BUSINESS SAS, Completa tus datos para habilitar los medios de contacto, +57, Aceptas nuestros","Apartamento esquinero en el conjunto Ciudad Hayuelos de 95 m2 excelente vista a la ciudad con una iluminación y distribución increíble con un ambiente familiar 5 estrellas. Compuesto por 3 habitaciones con closet (Habitación principal con walking closet  y con baño privado adicional terraza, sala comedor con balcón con vista al norte Adicional doble parqueadero y deposito.",,192333565,NC INTERNATIONAL BUSINESS SAS,https://www.fincaraiz.com.co/apartamento-en-venta/192333565,,
Apartamento,venta,Usado,"Tunja, Boyaca","Ub. villa olimpica, La pradera, Mesopotamia",68.00  m2 m²,2,2,$320.000.000,5,9 a 15 años,,", Ascensor, , Calentador, , Canchas Deportivas, , Cerca centro comercial, , Citófono, , Closet, , Piscina, , Sauna / Turco / Jacuzzi, , Shut de basura, , Tanques de Agua, , Trans. Público cercano, , Vista panorámica","Atos Inmobiliaria presenta la oportunidad de adquirir un apartamento excepcional ubicado sobre la avenida Olímpica, en uno de los sectores más destacados de la ciudad. Este apartamento, situado en el sexto piso del edificio El Cid, ofrece una distribución funcional que incluye sala-comedor, balcón cubierto, estudio, habitación y baño auxiliar, así como una habitación principal con baño privado. Disfruta de una excelente iluminación natural y de las comodidades de vivir cerca de importantes establecimientos como Makro, el centro comercial Unicentro y el centro comercial Boulevard. Además, el edificio brinda amenidades de primer nivel como gimnasio, salón social, terraza panorámica, piscina y zonas húmedas, garantizando un estilo de vida cómodo y sofisticado. ¡Contáctanos para más detalles y asegura tu inversión en este exclusivo apartamento!",Código Fincaraíz:,191273115,ATOS Inmobiliaria SAS,https://www.fincaraiz.com.co/apartamento-en-venta/191273115,,
Finca,venta,Usado,"Tunja, Boyaca","Tunja, Maldonado, Mesopotamia",79.00  m2 m²,¡Pregúntale!,¡Pregúntale!,$490.000.000,5,1 a 8 años,1,", Ascensor, , Baños comunales, , Baños Mixtos, , Circuito cerrado de TV, , Citófono, , Detección de humo, , Piso en Baldosa /  Mármol, , Portería / Recepción, , Rociadores de agua, , Salón de videoconferencias, , Servicios Públicos, , Sobre vía secundaria","Box House tiene en Venta - Oficina Edificio Enterprise, Tunja",,192004968,BOX HOUSE BIENES RAICES,https://www.fincaraiz.com.co/oficina-en-venta/192004968,,
Casa,venta,Usado,"Tunja, Boyaca","Tunja, Runta",280.00  m2 m²,3,3,$1.400.000.000,3,16 a 30 años,3 Habs.,", Balcón, , Cerca centro comercial, , Chimenea, , Cocina Integral, , Cocina tipo Americano, , Trans. Público cercano, , Vista panorámica, , Zona Campestre, , Zona Infantil, Descripción, CASA CAMPESTRES., Código Fincaraíz:, 191806030, Consultar, B&P Bienes y Proyectos SAS, Completa tus datos para habilitar los medios de contacto, +57, Aceptas nuestros",CASA CAMPESTRES.,,191806030,B&P Bienes y Proyectos SAS,https://www.fincaraiz.com.co/casa-campestre-en-venta/191806030,,
