tipo_inmueble,finalidad,estado_inmueble,ubicacion_principal,ubicacion_asociada,area,habitaciones,baños,precio,estrato,antigüedad,administración,comodidades,descripcion,contacto,codigo,vendedor,link_venta,link_image,error
Apartamento,venta,Usado,"Tunja, Boyaca","Tunja, Centro historico",74.00  m2 m²,3,2,$220.000.000,3,16 a 30 años,3 Habs.,", Cerca centro comercial, , Closet, , Sobre vía principal, , Trans. Público cercano, , Área Urbana, Descripción, Hermoso apartamento en el centro de la ciudad. Consta de 3 habitaciones, todas con closet incluido, 2 baños , sala comedor, cocina semi integral y área de ropas., Código Fincaraíz:, 191273868, Consultar, ATOS Inmobiliaria SAS, Completa tus datos para habilitar los medios de contacto, +57, Aceptas nuestros","Hermoso apartamento en el centro de la ciudad. Consta de 3 habitaciones, todas con closet incluido, 2 baños , sala comedor, cocina semi integral y área de ropas.",,191273868,ATOS Inmobiliaria SAS,https://www.fincaraiz.com.co/apartamento-en-venta/191273868,,
Lote,venta,Usado,"Tunja, Boyaca","Tunja, Ub. villa bachue",498.00  m2 m²,¡Pregúntale!,¡Pregúntale!,$488.500.600,3,menor a 1 año,,", Trans. Público cercano, , Zona Residencial, , Área Urbana, Descripción, Atos Inmobiliaria vende lote en el sur de la ciudad. Cuenta con un área bruta de 508 m², incluyendo andenes, y un área neta urbanizable de 498.47 m². Su uso multifamiliar lo convierte en una excelente opción para inversión y desarrollo de proyectos de vivienda. Ubicado en una zona de alta proyección, cerca de importantes vías de acceso, transporte público, colegios y comercios, facilitando la movilidad y valorización del sector. ¡No pierdas esta oportunidad! Contáctanos y agenda tu cita., Código Fincaraíz:, 192183929, Consultar, ATOS Inmobiliaria SAS, Completa tus datos para habilitar los medios de contacto, +57, Aceptas nuestros","Atos Inmobiliaria vende lote en el sur de la ciudad. Cuenta con un área bruta de 508 m², incluyendo andenes, y un área neta urbanizable de 498.47 m². Su uso multifamiliar lo convierte en una excelente opción para inversión y desarrollo de proyectos de vivienda. Ubicado en una zona de alta proyección, cerca de importantes vías de acceso, transporte público, colegios y comercios, facilitando la movilidad y valorización del sector. ¡No pierdas esta oportunidad! Contáctanos y agenda tu cita.",Código Fincaraíz:,192183929,ATOS Inmobiliaria SAS,https://www.fincaraiz.com.co/lote-en-venta/192183929,,
Casa,venta,Usado,"Tunja, Boyaca","Boyaca, Santa martha, El bosque",64.00  m2 m²,2,2,$180.000.000,3,1 a 8 años,2 Habs.,", Acceso Pavimentado, , Ascensor, , Barra estilo americano, , Baño Auxiliar, , Baño Independiente, , Calentador, , Garaje(s), , Hall de Alcobas, , Instalación de gas, , Parques cercanos, , Piso en Baldosa /  Mármol, , Portería / Recepción","Código: 8588FR895 Excelente oportunidad de adquirir apartamento cerca del nuevo centro comercial Florida Shopping Center, cerca de colegios y parques de la ciudad de Tunja, con fácil acceso de transporte público, el edificio cuenta con vigilancia privada, circuito de cámaras, zonas verdes, parque infantil, salón social y parqueadero para visitantes, este apartamento consta de dos habitaciones con posibilidad de una tercera, la habitación principal cuenta con baño privado y vestier,  baño social, cocina integral con meson en marmol, sala-comedor con chimenea, zona de estudio, zona de lavandería, parqueadero privado, se entrega encortinado con black out y persiana Sheer en las habitaciones y con panel japonés en la sala.",Código Fincaraíz:,192124553,Casa 360,https://www.fincaraiz.com.co/apartamento-en-venta/192124553,,
Apartamento,venta,Usado,"Villa olimpica, Tunja, Boyaca","La pradera, Tunja, Mesopotamia",130.00  m2 m²,3,2,$390.000.000,5,9 a 15 años,,", Ascensor, , Barra estilo americano, , Baño Auxiliar, , Calentador, , Citófono, , Cocina Integral, , Parques cercanos, , Portería / Recepción, , Sobre vía principal, , Supermercados / C.Comerciales, , Trans. Público cercano, , Vigilancia","SE VENDE HERMOSO APARTAMENTO, ubicado en el sector del cc Boulevard. área: 130 m2. El apartamento consta de sala, comedor, cocina integral, zona de lavandería, baño social, amplio star, 3 habitaciones, una con baño privado y un baño auxiliar,   dos garajes y bodega.",,10060684,INMOBILIARIA Y CONSTRUCTORA 2 MIL,https://www.fincaraiz.com.co/apartamento-en-venta/10060684,,
Finca,venta,Usado,"Tunja, Boyaca","Tunja, Ub. caminitos de oicata ii, Soamox",46.00  m2 m²,1,1,$175.000.000,4,1 a 8 años,,,"Atos Inmobiliaria Vende Apartaestudio en Barrio Coeducadores, Tunja",Código Fincaraíz:,191755805,ATOS Inmobiliaria SAS,https://www.fincaraiz.com.co/apartaestudio-en-venta/191755805,,
Casa,venta,Usado,"Tunja, Boyaca","Tunja, Centro historico",140.00  m2 m²,2,1,$298.000.000,4,más de 30 años,,,"Atos Inmobiliaria presenta esta excelente oportunidad de venta en el centro de la ciudad de Tunja:  casa con un área construida de aproximadamente 120 m² , mas un lote parte posterior de 95 m².",,191273819,ATOS Inmobiliaria SAS,https://www.fincaraiz.com.co/casa-en-venta/191273819,,
Casa,venta,Usado,"Tunja, Boyaca",Tunja,200.00  m2 m²,6,5,$620.000.000,5,1 a 8 años,,,"Atos Inmobiliaria vende una casa de tres pisos ubicada en el norte de Tunja, cerca de la Avenida Universitaria. Situada en un conjunto cerrado, esta propiedad está en proximidad a centros comerciales, colegios y universidades. En el primer piso, la casa ofrece un garaje, baño de servicio, sala, comedor, cocina integral y patio de ropas.",,191272894,ATOS Inmobiliaria SAS,https://www.fincaraiz.com.co/casa-en-venta/191272894,,
Casa,venta,Usado,"Tunja, Boyaca","Tunja, Bello horizonte, El carmen",240.00  m2 m²,9,3,$320.000.000,2,1 a 8 años,,,"Atos Inmobiliaria presenta una excelente oportunidad de inversión en Tunja. Se trata de una casa de 240 m2 en obra negra, ideal para un proyecto de desarrollo. La propiedad consta de tres pisos con una distribución específica.",,191273295,ATOS Inmobiliaria SAS,https://www.fincaraiz.com.co/casa-en-venta/191273295,,
Casa,venta,Usado,"Tunja, Tunja, Boyaca","Tunja, San ignacio, Centro historico",129.00  m2 m²,4,4,$320.000.000,4,16 a 30 años,,,"Se vende casa de 4 alcobas, 4 baños, 1 estudio, cocina, sala comedor, garaje y sótano. Excelente ubicación en el centro de la ciudad, bastantes vías de acceso y transporte publico",,191274072,ATOS Inmobiliaria SAS,https://www.fincaraiz.com.co/casa-en-venta/191274072,,
Lote,venta,Usado,"Tunja, Boyaca",Tunja,485.00  m2 m²,¡Pregúntale!,¡Pregúntale!,$436.500.000,5,1 a 8 años,,", Trans. Público cercano, , Vista panorámica, , Zona Campestre, , Zona Residencial, , Área Urbana, Descripción, Lote medianero en venta en excelente ubicación, consta de 485 m2, tiene 18 m de frente y 27 m de fondo., Código Fincaraíz:, 191273867, Consultar, ATOS Inmobiliaria SAS, Completa tus datos para habilitar los medios de contacto, +57, Aceptas nuestros","Lote medianero en venta en excelente ubicación, consta de 485 m2, tiene 18 m de frente y 27 m de fondo.",,191273867,ATOS Inmobiliaria SAS,https://www.fincaraiz.com.co/lote-en-venta/191273867,,
Apartamento,venta,Usado,"Tunja, Tunja, Boyaca","Tunja, Mesopotamia",96.00  m2 m²,3,2,$580.000.000,5,16 a 30 años,3 Habs.,", Ascensor, , Balcón, , Barra estilo americano, , Chimenea, , Circuito cerrado de TV, , Citófono, , Garaje Cubierto, , Hall de Alcobas, , Instalación de gas, , Jardín, , Piso de alta resistencia, , Piso en Madera","Ofrecemos para la venta un espectacular apartamento en Tunja, Boyacá. Se trata de una propiedad dúplex con altillo y sala auxiliar chimenea con tres amplias habitaciones que benefician de una vista impresionante a la ciudad. Este apartamento no amoblado te ofrece la oportunidad de personalizarlo a tu gusto. Imagina deliciosas cenas en la cocina americana mientras disfrutas de una charla amena con tus invitados en el salón comedor.",,11043884,PADS,https://www.fincaraiz.com.co/apartamento-en-venta/11043884,,
Apartamento,venta,Usado,"Tunja, Boyaca","Tunja, 15 de mayo",69.00  m2 m²,3,3,$325.000.000,5,1 a 8 años,,,Atos Inmobiliaria te Presenta Apartamento en el Norte de Tunja,Código Fincaraíz:,191465842,ATOS Inmobiliaria SAS,https://www.fincaraiz.com.co/apartamento-en-venta/191465842,,
Casa,venta,Usado,"Tunja, Boyaca","Tunja, Asis",131.00  m2 m²,3,2,$290.000.000,2,16 a 30 años,,", Canchas Deportivas, , Cerca centro comercial, , Cocina Integral, , Instalación de gas, , Piso en Baldosa /  Mármol, , Trans. Público cercano, Descripción, Atos Inmobiliaria ofrece en venta amplia casa esquinera ubicada en el norte de la ciudad. Cuenta con garaje, sala, comedor, cocina integral, patio de ropas y bodega. Dispone de tres habitaciones, dos con clóset, además de un cuarto que puede funcionar como estudio o una habitación adicional. Tiene dos baños y está acreditada para funcionar como cigarrería. ¡Gran oportunidad de inversión! Contáctanos y agenda tu cita., Código Fincaraíz:, 192103503, Consultar, ATOS Inmobiliaria SAS, Completa tus datos para habilitar los medios de contacto, +57, Aceptas nuestros","Atos Inmobiliaria ofrece en venta amplia casa esquinera ubicada en el norte de la ciudad. Cuenta con garaje, sala, comedor, cocina integral, patio de ropas y bodega. Dispone de tres habitaciones, dos con clóset, además de un cuarto que puede funcionar como estudio o una habitación adicional. Tiene dos baños y está acreditada para funcionar como cigarrería. ¡Gran oportunidad de inversión! Contáctanos y agenda tu cita.",Código Fincaraíz:,192103503,ATOS Inmobiliaria SAS,https://www.fincaraiz.com.co/apartaestudio-en-venta/192103503,,
Lote,venta,Usado,"Tunja, Tunja, Boyaca","Libertador, Tunja, La trinidad","43,300.00  m2 m²",¡Pregúntale!,¡Pregúntale!,$5.590.000.000,2,16 a 30 años,Código Fincaraíz:,", Área Urbana, Descripción, Excelente lote para venta en Tunja de 43.300 mts ideal para inversionista. Usos permitidos para vivienda, locales, centro comercial, plaza de mercado, oficinas, complejos empresariales, hoteles y hospedaje, estación de servicio, gobierno y administración, cultura, bienestar social, educación, esparcimiento y deportes, entre otros., Código Fincaraíz:, 191576312, Consultar, Rentkasa SAS, Completa tus datos para habilitar los medios de contacto, +57, Aceptas nuestros","Excelente lote para venta en Tunja de 43.300 mts ideal para inversionista. Usos permitidos para vivienda, locales, centro comercial, plaza de mercado, oficinas, complejos empresariales, hoteles y hospedaje, estación de servicio, gobierno y administración, cultura, bienestar social, educación, esparcimiento y deportes, entre otros.",,191576312,Rentkasa SAS,https://www.fincaraiz.com.co/lote-en-venta/191576312,,
Casa,venta,Usado,"Tunja, Boyaca","Popular, Tunja, Centro historico",170.00  m2 m²,7,3,$320.000.000,3,más de 30 años,,", Acceso Pavimentado, , Baño Auxiliar, , Cerca de Zona Urbana, , Closet, , Cocina Equipada, , Colegios / Universidades, , Piso en Baldosa /  Mármol, , Supermercados / C.Comerciales, , Trans. Público cercano, , Vista panorámica, , Vivienda Bifamiliar, , Zona Comercial","Código: 8974FR153 Venta de dos apartamentos independientes cerca al centro de la ciudad de Tunja, a pocos metros de plaza real, del centro de la ciudad, Universidad Santo Tomas y centro de comando de la policía Nacional, con fácil acceso de transporte público; un apartamento consta de tres alcobas, baño, cocina, sala-comedor y zona de lavandería, el otro apartamento consta de cuatro habitaciones, dos baños, sala comedor y zona de lavandería, están recién remodelados  y totalmente independientes.",Código Fincaraíz:,192247199,Casa 360,https://www.fincaraiz.com.co/apartamento-en-venta/192247199,,
Finca,venta,Usado,"Tunja, Tunja, Boyaca","Tunja, Centro historico",40.00  m2 m²,¡Pregúntale!,1,$160.000.000,4,¡Pregúntale!,1,", Ascensor, , Baños comunales, , Circuito cerrado de TV, , Parques cercanos, , Portería / Recepción, , Sobre vía secundaria, , Ubicada en edificio, , Zona Comercial, Descripción, Oficina  ubicada en el centro de la ciudad , consta de 43 m² y esta  estratégicamente ubicada en el cuarto piso del EdificioCamol, este consta de una amplia recepcion y seguridad 24hr, Código Fincaraíz:, 191117471, Consultar, ENTORNO URBANO, Completa tus datos para habilitar los medios de contacto, +57, Aceptas nuestros","Oficina  ubicada en el centro de la ciudad , consta de 43 m² y esta  estratégicamente ubicada en el cuarto piso del EdificioCamol, este consta de una amplia recepcion y seguridad 24hr",,191117471,ENTORNO URBANO,https://www.fincaraiz.com.co/oficina-en-venta/191117471,,
Apartamento,venta,Usado,"Tunja, Tunja, Boyaca","Tunja, El consuelo",66.00  m2 m²,2,1,$150.000.000,3,1 a 8 años,,", Baño Auxiliar, , Citófono, , Colegios / Universidades, , Parques cercanos, , Patio, , Piso en Baldosa /  Mármol, , Supermercados / C.Comerciales, , Trans. Público cercano, , Zona Comercial, , Zona Residencial, Descripción, EXCELENTE UBICACIÓN EN EL CENTRO HISTÓRICO DE TUNJA, OPCIONAL APARTAMENTO, ACTUALMENTE OFICINA O LOCAL . ENTREGAMOS PLANOS PARA TERMINAR APTO, SEGUNDO PISO ILUMINADO 65.71 M2 MAS PATIO INTERNO DE 11 M2 PARA UN TOTAL DE 77 M2. CONTACTAR CITA CON ADRIANA CALDERÓN AL CELULAR 320 CUATRO SIETE SEIS CUATRO CUATRO 74, Código Fincaraíz:, 192186640, Consultar, ADRIANA CALDERON, Completa tus datos para habilitar los medios de contacto, +57, Aceptas nuestros","EXCELENTE UBICACIÓN EN EL CENTRO HISTÓRICO DE TUNJA, OPCIONAL APARTAMENTO, ACTUALMENTE OFICINA O LOCAL . ENTREGAMOS PLANOS PARA TERMINAR APTO, SEGUNDO PISO ILUMINADO 65.71 M2 MAS PATIO INTERNO DE 11 M2 PARA UN TOTAL DE 77 M2. CONTACTAR CITA CON ADRIANA CALDERÓN AL CELULAR 320 CUATRO SIETE SEIS CUATRO CUATRO 74",,192186640,ADRIANA CALDERON,https://www.fincaraiz.com.co/apartamento-en-venta/192186640,,
Apartamento,venta,Usado,"Tunja, Tunja, Boyaca","Tunja, La esmeralda",110.75  m2 m²,3,2,$460.000.000,5,9 a 15 años,,", Ascensor, , Baño Auxiliar, , Colegios / Universidades, , Garaje(s), , Hall de Alcobas, , Instalación de gas, , Portería / Recepción, , Sobre vía principal, , Supermercados / C.Comerciales, , Trans. Público cercano, , Vigilancia, , Zona de lavandería","Vendo apartamento excelente ubicación cerca al centro comercial Unicentro y VIVA, con buena iluminación.",,10802183,Inmobiliaria Eskala,https://www.fincaraiz.com.co/apartamento-en-venta/10802183,,
Apartamento,venta,Usado,"Santa ines, Tunja, Boyaca","Santa ines, Tunja, Mesopotamia",90.00  m2 m²,3,2,$350.000.000,5,1 a 8 años,3 Habs.,", Acceso Pavimentado, , Ascensor, , Balcón, , Baño Auxiliar, , Baño Independiente, , Calentador, , Garaje(s), , Gimnasio, , Hall de Alcobas, , Instalación de gas, , Parqueadero Visitantes, , Parques cercanos","con la serenidad y tranquilidad del norte de Tunja. Este apartamento en el conjunto residencial Maria Fernanda no solo es un espacio, ¡es el hogar que siempre soñaste! Ofrece confort, seguridad y cercanía a todo lo que necesitas para comenzar una nueva etapa en tu vida. ?️?",,192249630,INMOBILIARIA LOS LANCEROS,https://www.fincaraiz.com.co/apartamento-en-venta/192249630,,
Lote,venta,Usado,"Tunja, Boyaca",Pirgua,"74,642.00  m2 m²",¡Pregúntale!,¡Pregúntale!,$12.500.000.000,1,1 a 8 años,,", Área Rural, Descripción, Excelentes lotes localizados en la Vereda de Pirgua, sobre la vía principal que conduce a Toca y Soracá., Código Fincaraíz:, 191419866, Consultar, ATOS Inmobiliaria SAS, Completa tus datos para habilitar los medios de contacto, +57, Aceptas nuestros","Excelentes lotes localizados en la Vereda de Pirgua, sobre la vía principal que conduce a Toca y Soracá.",,191419866,ATOS Inmobiliaria SAS,https://www.fincaraiz.com.co/lote-en-venta/191419866,,
Casa,venta,Usado,"La maria, Tunja, Boyaca","Univ pedag y tecno de colombia, Tunja, La carolina",230.00  m2 m²,4,4,$680.000.000,5,9 a 15 años,,", Acceso Pavimentado, , Baño Auxiliar, , Baño Independiente, , Calentador, , Cerca de Zona Urbana, , Chimenea, , Hall de Alcobas, , Instalación de gas, , Jardín, , Parqueadero Visitantes, , Parques cercanos, , Patio","Imagina despertar cada mañana en un hogar donde tranquilidad, seguridad y comodidad se encuentran perfectamente combinados. Esta hermosa casa en el Barrio La Maria, en el norte de Tunja, es mucho más que un espacio físico; es el lugar ideal para crear recuerdos inolvidables con tus seres queridos. ??",,192292196,INMOBILIARIA LOS LANCEROS,https://www.fincaraiz.com.co/casa-en-venta-en-la-maria-tunja/192292196,,
Apartamento,venta,Usado,"Tunja, Tunja, Boyaca","Tunja, Ub. florida parque, Ub. la florida",60.00  m2 m²,3,2,$200.000.000,3,menor a 1 año,3 Habs.,", Ascensor, , Garaje(s), , Portería / Recepción, , Vigilancia, Descripción, Gran oportunidad  para estrenar, apartamento en obra Gris consta de: 3 alcobas , 2 baños, sala, comedor, cocina, zona de ropas, deposito y parqueadero. Ubicado en nogales de la florida., Código Fincaraíz:, 10400183, Consultar, Inmobiliaria Fenix, Completa tus datos para habilitar los medios de contacto, +57, Aceptas nuestros","Gran oportunidad  para estrenar, apartamento en obra Gris consta de: 3 alcobas , 2 baños, sala, comedor, cocina, zona de ropas, deposito y parqueadero. Ubicado en nogales de la florida.",,10400183,Inmobiliaria Fenix,https://www.fincaraiz.com.co/apartamento-en-venta/10400183,,
Casa,venta,Usado,"Jose antonio galan, Tunja, Boyaca","Tunja, Ub. soaquira, Jose antonio galan",200.00  m2 m²,5,3,$330.000.000,3,9 a 15 años,,", Baño Auxiliar, , Calentador, , Cocina Integral, , Colegios / Universidades, , Estudio, , Instalación de gas, , Piso en Baldosa /  Mármol, , Sobre vía principal, , Supermercados / C.Comerciales, , Trans. Público cercano, , Zona Comercial, , Zona de lavandería","**Primer piso: Sala, Comedor, Cocina integral, garaje, 1 baño, estudio, patio de ropas",,10203680,ENTORNO URBANO,https://www.fincaraiz.com.co/casa-en-venta/10203680,,
Casa,venta,Usado,"Centro, Tunja, Boyaca","Centro, Tunja, Centro historico",190.00  m2 m²,4,3,$500.000.000,4,¡Pregúntale!,,,"VENDO CASA EN EL CENTRO DE TUNJA,   con dos locales comerciales independientes con baño privado,  acceso independiente para la casa,  de cuatro alcobas,  tres baños,   sala comedor,  cocina,  construcción  en un solo piso,  excelentes condiciones. 1019190m2. OPORTUNIDAD!!.",,7249074,Inmobiliaria Fenix,https://www.fincaraiz.com.co/casa-en-venta/7249074,,
Lote,venta,Usado,"Tunja, Boyaca","Tunja, Ub. canapro",224.00  m2 m²,¡Pregúntale!,¡Pregúntale!,$340.000.000,4,1 a 8 años,,,"Excelente oportunidad: Lote doble esquinero al norte de la ciudad, con 224 m2 y tres frentes. Ideal para construcción de vivienda unifamiliar. ¡Contáctanos para más detalles y asegura tu inversión!",Código Fincaraíz:,191273238,ATOS Inmobiliaria SAS,https://www.fincaraiz.com.co/lote-en-venta/191273238,,
Casa,venta,Usado,"Tunja, Boyaca","Tunja, Cr. la reserva campestre",166.00  m2 m²,4,4,$1.800.000.000,6,16 a 30 años,,", Closet, , Instalación de gas, , Terraza, , Trans. Público cercano, , Vista panorámica, , Zona Comercial, , Zona de BBQ, , Zona Residencial, Descripción, Una casa campestre en el barrio La Villita, con un lote de 1693 metros cuadrados y una construcción de 166 metros cuadrados. Dispone de 4 amplias habitaciones, 4 baños, sala y comedor, una magnífica cocina integral y un patio de ropas cubierto. Además, cuenta con zona de BBQ, dos terrazas grandes, huerto de frutas y dos cabañas de 4x4 metros. Ubicada cerca del Centro Comercial Viva Tunja, ofrece comodidad y tranquilidad en un entorno natural., Código Fincaraíz:, 191273105, Consultar, ATOS Inmobiliaria SAS, Completa tus datos para habilitar los medios de contacto, +57, Aceptas nuestros","Una casa campestre en el barrio La Villita, con un lote de 1693 metros cuadrados y una construcción de 166 metros cuadrados. Dispone de 4 amplias habitaciones, 4 baños, sala y comedor, una magnífica cocina integral y un patio de ropas cubierto. Además, cuenta con zona de BBQ, dos terrazas grandes, huerto de frutas y dos cabañas de 4x4 metros. Ubicada cerca del Centro Comercial Viva Tunja, ofrece comodidad y tranquilidad en un entorno natural.",,191273105,ATOS Inmobiliaria SAS,https://www.fincaraiz.com.co/casa-en-venta/191273105,,
Casa,venta,Usado,"Tunja, Boyaca","Tunja, Altagracia",490.00  m2 m²,5,5,$1.900.000.000,6,más de 30 años,,", Acceso Pavimentado, , Baño Auxiliar, , Baño Independiente, , Bósque nativo, , Canchas Deportivas, , Cerca de Zona Urbana, , Garaje(s), , Instalación de gas, , Jardín, , Patio, , Piso en Baldosa /  Mármol, , Supermercados / C.Comerciales","Código: 89890FR52 Excelente oportunidad de adquirir casa campestre en la ciudad de Tunja, cerca de la Universidad Santo Tomas, clínicas, colegios y centros comerciales, cuenta con buen transporte público, zona de alta valorización la cual consta de cinco habitaciones con closet, la principal con baño privado y vestier, cuatro baños sociales, sala- comedor, zona de estudio, sala de estar con chimenea, cocina equipada, amplia zona de lavandería, parqueadero para cinco vehículos, amplias zonas verdes con magníficos jardines.",Código Fincaraíz:,192263261,Casa 360,https://www.fincaraiz.com.co/casa-campestre-en-venta-en-tunja/192263261,,
Lote,venta,Usado,"Santa ines, Tunja, Boyaca","Mesopotamia, Santa ines, Tunja","2,147.00  m2 m²",¡Pregúntale!,¡Pregúntale!,$5.300.000.000,5,¡Pregúntale!,,", Cerca a sector comercial, , Esquinero, , Sobre vía principal, , Área Urbana, Descripción, EXCELENTE OPORTUNIDAD PARA CONSTRUCCIÓN EN LA ESQUINA DE UNICENTRO,  ubicado en la zona de mas alta valorización de Tunja,  con uso de suelo mixto,  comercial,  vivienda multifamiliar...., Código Fincaraíz:, 5155143, Consultar, Inmobiliaria Fenix, Completa tus datos para habilitar los medios de contacto, +57, Aceptas nuestros","EXCELENTE OPORTUNIDAD PARA CONSTRUCCIÓN EN LA ESQUINA DE UNICENTRO,  ubicado en la zona de mas alta valorización de Tunja,  con uso de suelo mixto,  comercial,  vivienda multifamiliar....",,5155143,Inmobiliaria Fenix,https://www.fincaraiz.com.co/lote-en-venta/5155143,,
Apartamento,venta,Usado,"Tunja, Boyaca","Maldonado, Tunja, Mesopotamia",68.00  m2 m²,3,2,$170.000.000,3,9 a 15 años,3 Habs.,", Baño Auxiliar, , Cocina Integral, , Colegios / Universidades, , Instalación de gas, , Parques cercanos, , Piso en Baldosa /  Mármol, , Portería / Recepción, , Trans. Público cercano, , Vigilancia, , Zona Comercial, Descripción, EN VENTA APARTAMENTO UBICADO EN ZONA COMERCIAL Y ESTUDIANTIL DE LA CIUDAD.  Cerca al Universidad de Boyacá- Sector Capitolio   Área: 68 m2+  Parqueadero    3 Habitaciones  Alcoba ppal con baño  Cocina integral  Sala y comedor., Código Fincaraíz:, 7697852, Consultar, INMOBILIARIA Y CONSTRUCTORA 2 MIL, Completa tus datos para habilitar los medios de contacto, +57, Aceptas nuestros",EN VENTA APARTAMENTO UBICADO EN ZONA COMERCIAL Y ESTUDIANTIL DE LA CIUDAD.  Cerca al Universidad de Boyacá- Sector Capitolio   Área: 68 m2+  Parqueadero    3 Habitaciones  Alcoba ppal con baño  Cocina integral  Sala y comedor.,,7697852,INMOBILIARIA Y CONSTRUCTORA 2 MIL,https://www.fincaraiz.com.co/apartamento-en-venta/7697852,,
Lote,venta,Usado,"Tunja, Boyaca","Ub. las quintas, Tunja",650.00  m2 m²,11,10,$6.200.000.000,5,9 a 15 años,,,"Atos Inmobiliaria presenta en venta un completo centro médico ubicado en el barrio Las Quintas, al lado de la Clínica Cancerológica. Este destacado espacio cuenta con 11 consultorios, cada uno con su baño privado, proporcionando comodidad y privacidad para profesionales de la salud. Además, ofrece 13 parqueaderos, sala de recepción, auditorio con capacidad para 50 personas, central de mando y servicios, depósito, cuarto de residuos sólidos y biológicos, cuarto de cilindros de oxígeno, local comercial, cuatro baños externos y dos cuartos de aseo. Con un área de lote de 1146 m2 y una construcción aproximada de 650 m2, este centro médico se presenta como una excelente inversión. Contáctanos para obtener más información y coordinar una visita. Estamos aquí para ayudarte en tus necesidades inmobiliarias. ¡No pierdas esta oportunidad!",Código Fincaraíz:,191273237,ATOS Inmobiliaria SAS,https://www.fincaraiz.com.co/edificio-en-venta/191273237,,
Casa,venta,Usado,"Tunja, Tunja, Boyaca","Santa ines, Ub. las quintas, Tunja",160.00  m2 m²,3,3,$450.000.000,5,9 a 15 años,,", Baño Auxiliar, , Calentador, , Chimenea, , Citófono, , Cocina Integral, , Colegios / Universidades, , Hall de Alcobas, , Instalación de gas, , Parques cercanos, , Patio, , Piso en Baldosa /  Mármol, , Supermercados / C.Comerciales","Vendo espectacular casa en Santa Inés,  cerca al centro comercial Unicentro de Tunja. consta: sala con chimenea,  comedor,  cocina integral ,  zona de ropas,  cuarto y baño de servicio,  patio cubierto,  estar con marquesina,  estudio,  tres alcobas con closet,  tres baños y garaje..",,7707634,Inmobiliaria Eskala,https://www.fincaraiz.com.co/casa-en-venta/7707634,,
Casa,venta,Usado,"Tunja, Boyaca","Tunja, Soamox, Capitolio",6.00  m2 m²,¡Pregúntale!,¡Pregúntale!,$69.000.000,4,1 a 8 años,6,,"Se vende isla comercial en el Centro Comercial Casa Vieja, ubicada al norte de la ciudad. Esta isla tiene una ubicación estratégica debido a su cercanía con colegios, la Clínica Medilaser y la Universidad de Boyacá, lo que la convierte en un lugar ideal para establecer un negocio.",,191273481,ATOS Inmobiliaria SAS,https://www.fincaraiz.com.co/local-en-venta/191273481,,
