tipo_inmueble,finalidad,estado_inmueble,ubicacion_principal,ubicacion_asociada,area,habitaciones,baños,precio,estrato,antigüedad,administración,comodidades,descripcion,contacto,codigo,vendedor,link_venta,link_image,error
Casa,venta,Usado,"Tunja, Boyaca","Tunja, Aquinin, El paraiso",258.00  m2 m²,6,4,$890.000.000,3,9 a 15 años,,", Canchas Deportivas, , Cerca centro comercial, , Cocineta, , Piso en Alfombra, , Piso en Baldosa /  Mármol, , Salón Comunal, , Sobre vía principal, , Tanques de Agua, , Trans. Público cercano, , Vista panorámica, , Zona Comercial, Descripción, Atos Inmobiliaria te ofrece casa lote ubicada estratégicamente cerca de la Avenida Norte, ideal para inversión o vivienda familiar. La propiedad cuenta con dos apartamentos independientes. El primer apartamento tiene dos habitaciones, un baño, sala-comedor, cocina básica y patio de ropas. El segundo apartamento dispone de tres habitaciones, dos baños, sala-comedor, cocina básica y patio de ropas. Además, incluye una habitación independiente con baño, un local comercial, un jardín y un lote posterior con una extensión aproximada de 120 m². Esta propiedad ofrece múltiples posibilidades de uso en una ubicación privilegiada., Código Fincaraíz:, 191922079, Consultar, ATOS Inmobiliaria SAS, Completa tus datos para habilitar los medios de contacto, +57, Aceptas nuestros","Atos Inmobiliaria te ofrece casa lote ubicada estratégicamente cerca de la Avenida Norte, ideal para inversión o vivienda familiar. La propiedad cuenta con dos apartamentos independientes. El primer apartamento tiene dos habitaciones, un baño, sala-comedor, cocina básica y patio de ropas. El segundo apartamento dispone de tres habitaciones, dos baños, sala-comedor, cocina básica y patio de ropas. Además, incluye una habitación independiente con baño, un local comercial, un jardín y un lote posterior con una extensión aproximada de 120 m². Esta propiedad ofrece múltiples posibilidades de uso en una ubicación privilegiada.",,191922079,ATOS Inmobiliaria SAS,https://www.fincaraiz.com.co/casa-en-venta/191922079,,
Finca,venta,Usado,"Tunja, Boyaca","Tunja, Centro historico, El consuelo",68.00  m2 m²,¡Pregúntale!,2,$300.000.000,4,9 a 15 años,2,", Ascensor, , Loft, , Piso en Baldosa /  Mármol, , Tanques de Agua, , Trans. Público cercano, Descripción, Ofrecemos en venta una oficina ubicada en el centro de la ciudad de Tunja. Con un área de 68 m², esta oficina cuenta con dos baños, un depósito pequeño y un parqueadero cubierto. La oficina tiene una vista exterior y recibe abundante iluminación natural, lo que proporciona un ambiente de trabajo agradable y cómodo.","Ofrecemos en venta una oficina ubicada en el centro de la ciudad de Tunja. Con un área de 68 m², esta oficina cuenta con dos baños, un depósito pequeño y un parqueadero cubierto. La oficina tiene una vista exterior y recibe abundante iluminación natural, lo que proporciona un ambiente de trabajo agradable y cómodo.",Código Fincaraíz:,191272873,ATOS Inmobiliaria SAS,https://www.fincaraiz.com.co/oficina-en-venta/191272873,,
Casa,venta,Usado,"Tunja, Boyaca","El jordan, Co. mt. cooservicios, Tunja",79.00  m2 m²,3,2,$220.000.000,3,9 a 15 años,3 Habs.,", Acceso Pavimentado, , Balcón, , Baño Auxiliar, , Baño Independiente, , Calentador, , Cerca de Zona Urbana, , Instalación de gas, , Jardín, , Parqueadero Visitantes, , Parques cercanos, , Piso en Baldosa /  Mármol, , Portería / Recepción","Código: 899FR1148 Excelente oportunidad de adquirir casa en un conjunto cerrado de la ciudad de Tunja, con fácil acceso de transporte público; la casa consta de tres alcobas con closet, dos baños con división en vidrio, cocina integral, sala-comedor, estudio, terraza, bodega, zona de lavandería.",Código Fincaraíz:,192265180,Casa 360,https://www.fincaraiz.com.co/casa-en-venta-en-tunja/192265180,,
Casa,venta,Usado,"Tunja, Boyaca","Ub. las quintas, Tunja",214.00  m2 m²,5,4,$590.000.000,5,9 a 15 años,,,"Esta es una excelente oportunidad de inversión en una casa bifamiliar estratégicamente ubicada cerca del CC Viva y la Universidad Santo Tomás. En la planta baja, encontrarás un apartamento independiente con sala, comedor, cocina abierta, un baño, zona de lavado y dos habitaciones. El segundo apartamento, ubicado en la segunda planta y con acceso desde la calle y su propio garaje, ofrece sala, comedor, balcón, cocina integral, área de lavado, dos habitaciones y dos baños. En el tercer nivel, se encuentra la habitación principal, que cuenta con terraza, baño y vestidor. Además, la casa cuenta con calefacción por piso, lo que garantiza un ambiente cálido y confortable en todo momento. Esta es una oportunidad única para invertir en una propiedad con gran potencial.",,191273854,ATOS Inmobiliaria SAS,https://www.fincaraiz.com.co/casa-en-venta/191273854,,
Casa,venta,Usado,"Tunja, Boyaca","Tunja, Pirgua",67.00  m2 m²,1,¡Pregúntale!,$450.000.000,5,9 a 15 años,1,", Acceso Pavimentado, , Ascensor, , Canchas Deportivas, , Cerca de Zona Urbana, , Circuito cerrado de TV, , Cochera, , Parques cercanos, , Piso en Baldosa /  Mármol, , Portería / Recepción, , Sobre vía principal, , Supermercados / C.Comerciales, , Terraza","Código: 8991fr812 Excelente oportunidad de adquirir oficina con una encantadora vista, en el Centro Empresarial Green Hills en la ciudad de Tunja, cerca de la Universidad de Boyacá, Centro comercial Viva, Colegio San Viator, con fácil acceso de transporte público además de ser una zona de alta valorización, este consta de una amplia oficina muy iluminada, el Centro Empresarial cuenta con baños sociales, sala de juntas, ascensor, ingreso para discapacitados, parque para niños.",Código Fincaraíz:,192265700,Casa 360,https://www.fincaraiz.com.co/oficina-en-venta-en-tunja/192265700,,
Casa,venta,Usado,"Tunja, Boyaca","Tunja, Santa ines, Mesopotamia",145.00  m2 m²,4,4,$600.000.000,4,más de 30 años,,,"¡ATOS INMOBILIARIA tiene para usted un tesoro escondido en el corazón de Santa Inés! Una casa remodelada de 145 m² que fusiona el encanto tradicional con comodidades modernas. En la planta baja, encontrará una acogedora sala, comedor, estudio, cocina integral, zona de ropas y baño social.",,191273033,ATOS Inmobiliaria SAS,https://www.fincaraiz.com.co/casa-en-venta/191273033,,
Finca,venta,Usado,"Tunja, Tunja, Boyaca","Tunja, Centro historico",48.00  m2 m²,¡Pregúntale!,2,$350.000.000,4,16 a 30 años,,,"Atos Inmobiliaria tiene disponible para venta un local comercial con bodega en sótano en una ubicación privilegiada en pleno centro de la ciudad, a pocas cuadras de la Plaza de Bolívar. Este local cuenta con un área de 48 m2 y dispone de un baño para su comodidad. La bodega, ubicada en el sótano, también cuenta con un baño.",Código Fincaraíz:,191274049,ATOS Inmobiliaria SAS,https://www.fincaraiz.com.co/local-en-venta/191274049,,
Finca,venta,Usado,"Tunja, Boyaca","Mesopotamia, Tunja, Santa ines",34.00  m2 m²,¡Pregúntale!,¡Pregúntale!,$253.894.900,5,menor a 1 año,,", Ascensor, , Trans. Público cercano, , Zona Comercial, , Zona Residencial, Descripción, Atos Inmobiliaria presenta Proyecto de Locales y Oficinas Comerciales en el Norte de Tunja",Atos Inmobiliaria presenta Proyecto de Locales y Oficinas Comerciales en el Norte de Tunja,,191603912,ATOS Inmobiliaria SAS,https://www.fincaraiz.com.co/oficina-en-venta/191603912,,
Apartamento,venta,Usado,"Tunja, Boyaca","Mesopotamia, La pradera, Tunja",58.00  m2 m²,2,1,$230.000.000,5,1 a 8 años,2 Habs.,", Acceso Pavimentado, , Ascensor, , Balcón, , Baño Auxiliar, , Calentador, , Cerca de Zona Urbana, , Parqueadero Visitantes, , Parques cercanos, , Piso en Baldosa /  Mármol, , Portería / Recepción, , Salón Comunal, , Sobre vía principal","?Imagínate entrando a un espacio que no solo se convierte en una extensión de tu estilo de vida, sino que también impulsa tus sueños de crecer tu patrimonio familiar. Este apartamento en Tunja te invita a transformar tu visión de futuro en realidad.",,191884226,INMOBILIARIA LOS LANCEROS,https://www.fincaraiz.com.co/apartamento-en-venta/191884226,,
Apartamento,venta,Usado,"Tunja, Tunja, Boyaca","Tunja, San ignacio, Centro historico","1,500.00  m2 m²",1,10,$9.000.000.000,3,más de 30 años,,", Ascensor, , Ascensor Privado, , Baños comunales, , Baños comunales, , Cerca centro comercial, , Cocineta, , Parqueadero Subterraneo, , Parqueadero Visitantes, , Portería / Recepción, , Portería / Recepción, , Puerta de seguridad, , Salón de conferencias","Hermoso hotel, ubicado en el centro histórico de la ciudad, edificio 4 pisos y sótano; piso uno: local, oficina, recepción, cocina industrial, 6 habitaciones con baño; piso dos: 11 habitaciones con baño, habitación con jacuzzi; piso tres: 7 habitaciones con baño, 2 habitaciones con jacuzzi; piso cuarto: sala de conferencias, sala de juntas, dos baños sociales y un apartamento; sótano: 9 parqueaderos, cuarto de máquinas, cuarto depósito; adicionales: escaleras, ascensor, 14 paneles solares, calentador gas.",,10334835,GRUPO INMOBILIARIO EL REFUGIO LTDA,https://www.fincaraiz.com.co/edificio-en-venta/10334835,,
Casa,venta,Usado,"Tunja, Boyaca","Tunja, Ub. canapro, Ub. palos verdes",138.00  m2 m²,3,3,$610.000.000,5,1 a 8 años,3 Habs.,", Acceso Pavimentado, , Barra estilo americano, , Baño Auxiliar, , Baño Independiente, , Calentador, , Canchas Deportivas, , Garaje(s), , Instalación de gas, , Jardín, , Parqueadero Visitantes, , Parques cercanos, , Patio","Código: 899FR1818 Excelente oportunidad de adquirir casa en conjunto cerrado en uno de los sectores más cotizados de la ciudad de Tunja, con fácil acceso de transporte público; a pocas cuadras del Colegio de los Ángeles, Clínica Medilaser, Universidad de Boyacá y Green Hills, esta consta de tres alcobas con closet, la habitación principal con vestier y baño privado con jacuzzi, dos baños sociales, cocina integral tipo isla, sala-comedor, estudio, zona de lavandería y dos parqueaderos, el conjunto cuenta con vigilancia presencial las veinticuatro horas del día.",Código Fincaraíz:,192265707,Casa 360,https://www.fincaraiz.com.co/casa-en-venta-en-tunja/192265707,,
Casa,venta,Usado,"Tunja, Boyaca","Tunja, Las nieves",91.00  m2 m²,3,3,$350.000.000,2,16 a 30 años,3 Habs.,", Barra estilo americano, , Baño Auxiliar, , Baño Independiente, , Cerca de Zona Urbana, , Citófono, , Closet, , Parqueadero Visitantes, , Parques cercanos, , Patio, , Piso en Baldosa /  Mármol, , Portería / Recepción, , Salón Comunal","Código: 899FR1175 Excelente oportunidad de adquirir casa a pocas cuadras del centro de la ciudad de Tunja, cerca de la facultad de medicina, Universidad Antonio Nariño, Hospital San Rafael, con fácil acceso de transporte público; consta de tres alcobas con closet, la habitación principal con baño privado, dos baños sociales, cocina integral, sala-comedor, zona de lavandería y parqueadero, el conjunto cuenta con salón social y parque infantil.",Código Fincaraíz:,192265225,Casa 360,https://www.fincaraiz.com.co/casa-en-venta-en-tunja/192265225,,
Lote,venta,Usado,"Tunja, Boyaca","Tunja, Pirgua",1.00  m2 m²,¡Pregúntale!,¡Pregúntale!,$4.974.000.000,4,16 a 30 años,,", Acceso Pavimentado, , Bósque nativo, , Canchas Deportivas, , Cerca de Zona Urbana, , Colegios / Universidades, , Parques cercanos, , Supermercados / C.Comerciales, , Trans. Público cercano, , Zona Comercial, , Zona Industrial, , Zona Residencial, , Zonas Verdes",? ¡Gran Oportunidad de Inversión en Tunja! Lote de 4.974 m² con Ubicación Privilegiada ?,,191626136,Remax Planet,https://www.fincaraiz.com.co/lote-en-venta/191626136,,
Apartamento,venta,Usado,"Centro, Tunja, Boyaca","Centro, Tunja, Centro historico",240.00  m2 m²,4,5,$650.000.000,4,¡Pregúntale!,4 Habs.,", Ascensor, , Colegios / Universidades, , Cuarto de servicio, , Duplex, , Garaje(s), , Supermercados / C.Comerciales, , Trans. Público cercano, , Vigilancia, Descripción, VENDO APARTAMENTO DUPLEX EN EL CENTRO DE 240M2 con excelente distribucion e iluminacion  este sensacional apartamento consta de  Primer nivel,  Sala comedor,  cocina integral,  zona de ropas,  cuarto de servicio con baño,  baño social,  una alcoba,  Segundo nivel,  Estudio,  terraza con chimenea,  alcoba principal con vestier y baño privado,  dos alcobas auxiliares, baño de alcobas y garaje doble., Código Fincaraíz:, 7799774, Consultar, Inmobiliaria Fenix, Completa tus datos para habilitar los medios de contacto, +57, Aceptas nuestros","VENDO APARTAMENTO DUPLEX EN EL CENTRO DE 240M2 con excelente distribucion e iluminacion  este sensacional apartamento consta de  Primer nivel,  Sala comedor,  cocina integral,  zona de ropas,  cuarto de servicio con baño,  baño social,  una alcoba,  Segundo nivel,  Estudio,  terraza con chimenea,  alcoba principal con vestier y baño privado,  dos alcobas auxiliares, baño de alcobas y garaje doble.",,7799774,Inmobiliaria Fenix,https://www.fincaraiz.com.co/apartamento-en-venta/7799774,,
Casa,venta,Usado,"Comuna 1, Tunja, Boyaca","Ub. alcala real, Tunja, Ub. balcones de terranova",160.00  m2 m²,4,3,$450.000.000,4,¡Pregúntale!,4 Habs.,", Circuito cerrado de TV, , Citófono, , Cocina Integral, , Depósito / Bodega, , Despensa, , Estudio, , Portería / Recepción, , Zona de lavandería, Descripción, Casa en conjunto cerrado, Código Fincaraíz:, 191679739, Consultar, NUESTRA CASA INMOBILIARIA, Completa tus datos para habilitar los medios de contacto, +57, Aceptas nuestros",Casa en conjunto cerrado,,191679739,NUESTRA CASA INMOBILIARIA,https://www.fincaraiz.com.co/casa-en-venta/191679739,,
Casa,venta,Usado,"Tras del alto, Tunja, Boyaca",Tras del alto,90.00  m2 m²,2,1,$340.000.000,3,¡Pregúntale!,,", Chimenea, , Cocina de leña, , Cocina Integral, , Garaje / Parqueadero(s), , Servicios Públicos, , Vista panorámica, Descripción, Hermosa finca a 50m de via pavimentada, excelente panoramica cuenta con un area de lote de 2 hectareas y una maravillosa casa la cual consta de 2 alcobas, 1 baño, sala con chimena, comedor, cocina integral., Código Fincaraíz:, 10946544, Consultar, Inmobiliaria Fenix, Completa tus datos para habilitar los medios de contacto, +57, Aceptas nuestros","Hermosa finca a 50m de via pavimentada, excelente panoramica cuenta con un area de lote de 2 hectareas y una maravillosa casa la cual consta de 2 alcobas, 1 baño, sala con chimena, comedor, cocina integral.",,10946544,Inmobiliaria Fenix,https://www.fincaraiz.com.co/finca-en-venta/10946544,,
Casa,venta,Usado,"Tunja, Boyaca","Tunja, Pirgua",19.00  m2 m²,¡Pregúntale!,1,$110.000.000,4,1 a 8 años,,,"Atos Inmobiliaria tiene una excelente oportunidad de inversión para ti. Se trata de un consultorio en venta ubicado en el centro comercial Casa Vieja, una zona muy conveniente al norte de la ciudad y a pocos pasos de la Clínica Medilaser. Este consultorio cuenta con un área de 19 metros cuadrados y está equipado con un baño para la comodidad de tus pacientes.",Código Fincaraíz:,191273572,ATOS Inmobiliaria SAS,https://www.fincaraiz.com.co/consultorio-en-venta/191273572,,
Casa,venta,Usado,"Tunja, Boyaca","Maldonado, Tunja, Mesopotamia",318.00  m2 m²,8,3,$850.000.000,3,16 a 30 años,,", Acceso Pavimentado, , Garaje / Parqueadero(s), , Servicios Públicos, , Sobre vía principal, , Trans. Público cercano, Descripción, INMOBILIARIA 2 MIL VENDE  CASA-LOTE, Ubicado en el sector Norte de Tunja, Área lote: 211 mts2, Área construida: 318 mts2. Casa esquinera, Tres plantas. 1°er piso: 2 locales comerciales, uno esquinero., 2°do piso: 1 apartamento que consta de sala, comedor, cocina, baños social y 4 habitaciones. 3°er piso:  2 apartamentos, cada apartamento con sala, comedor, cocina, baño y 2 habitaciones. VALOR: 850.000.000, Código Fincaraíz:, 192055081, Consultar, INMOBILIARIA Y CONSTRUCTORA 2 MIL, Completa tus datos para habilitar los medios de contacto, +57, Aceptas nuestros","INMOBILIARIA 2 MIL VENDE  CASA-LOTE, Ubicado en el sector Norte de Tunja, Área lote: 211 mts2",,192055081,INMOBILIARIA Y CONSTRUCTORA 2 MIL,https://www.fincaraiz.com.co/casa-lote-en-venta/192055081,,
Finca,venta,Usado,"Tunja, Boyaca","Tunja, Soamox, Coeducadores",47.00  m2 m²,1,1,$145.000.000,4,1 a 8 años,,", Calentador, , Canchas Deportivas, , Cerca centro comercial, , Closet, , Cocina Integral, , Instalación de gas, , Trans. Público cercano, , Zona Comercial, , Zona Residencial, Descripción, Atos Inmobiliaria Vende Apartaestudio en el Norte de Tunja",Atos Inmobiliaria Vende Apartaestudio en el Norte de Tunja,Código Fincaraíz:,191614906,ATOS Inmobiliaria SAS,https://www.fincaraiz.com.co/apartaestudio-en-venta/191614906,,
Finca,venta,Usado,"Tunja, Boyaca","Tunja, La pradera, Mesopotamia",37.00  m2 m²,1,¡Pregúntale!,$250.000.000,5,1 a 8 años,1,", Cerca centro comercial, , Trans. Público cercano, , Vista panorámica, , Zona Comercial, Descripción, ¡Invierte en una ubicación estratégica! Atos Inmobiliaria vende local comercial con excelente ubicación en una de las zonas más dinámicas y de alto tráfico del norte de la ciudad. El local cuenta con un área de 37 metros cuadrados, ideal para negocios u oficinas (no habilitado para venta de comidas). Ubicado en un reconocido sector comercial con alto flujo peatonal y vehicular, rodeado de bancos, supermercados, oficinas y centros empresariales. Una oportunidad de inversión rentable en una zona de constante valorización. Contáctanos para más información y agenda tu cita hoy mismo. ¡No dejes pasar esta oportunidad!, Código Fincaraíz:, 192338351, Consultar, ATOS Inmobiliaria SAS, Completa tus datos para habilitar los medios de contacto, +57, Aceptas nuestros","¡Invierte en una ubicación estratégica! Atos Inmobiliaria vende local comercial con excelente ubicación en una de las zonas más dinámicas y de alto tráfico del norte de la ciudad. El local cuenta con un área de 37 metros cuadrados, ideal para negocios u oficinas (no habilitado para venta de comidas). Ubicado en un reconocido sector comercial con alto flujo peatonal y vehicular, rodeado de bancos, supermercados, oficinas y centros empresariales. Una oportunidad de inversión rentable en una zona de constante valorización. Contáctanos para más información y agenda tu cita hoy mismo. ¡No dejes pasar esta oportunidad!",Código Fincaraíz:,192338351,ATOS Inmobiliaria SAS,https://www.fincaraiz.com.co/local-en-venta/192338351,,
Apartamento,venta,Usado,"Tunja, Boyaca","Tunja, San ignacio, Centro historico",82.00  m2 m²,3,2,$320.000.000,3,menor a 1 año,3 Habs.,", Cerca centro comercial, , Closet, , Cocina Integral, , Instalación de gas, , Piso en Baldosa /  Mármol, , Trans. Público cercano, , Área Urbana, Descripción, Atos Inmobiliaria vende apartamento ubicado en el centro de la ciudad. Este espacioso inmueble cuenta con tres habitaciones, dos baños, sala-comedor, cocina integral y zona de ropas. Su ubicación privilegiada te permite acceder fácilmente a todo lo que necesitas. ¡No dejes pasar esta excelente oportunidad! Contáctanos y agenda tu cita hoy mismo., Código Fincaraíz:, 192084357, Consultar, ATOS Inmobiliaria SAS, Completa tus datos para habilitar los medios de contacto, +57, Aceptas nuestros","Atos Inmobiliaria vende apartamento ubicado en el centro de la ciudad. Este espacioso inmueble cuenta con tres habitaciones, dos baños, sala-comedor, cocina integral y zona de ropas. Su ubicación privilegiada te permite acceder fácilmente a todo lo que necesitas. ¡No dejes pasar esta excelente oportunidad! Contáctanos y agenda tu cita hoy mismo.",Código Fincaraíz:,192084357,ATOS Inmobiliaria SAS,https://www.fincaraiz.com.co/apartamento-en-venta/192084357,,
Finca,venta,Usado,"Tunja, Boyaca","Tunja, Centro historico",21.00  m2 m²,¡Pregúntale!,1,$165.000.000,4,1 a 8 años,1,,"En venta: Local en el Centro Comercial Paseo de la Salamandra, con una superficie de 21.85 m2. Este local ofrece una vitrina amplia con doble puerta y baño privado, además de contar con un mezanine cerrado y un acceso adicional por el baño. Su ubicación en el corazón de la ciudad, a solo media cuadra de la Plazoleta San Francisco y a dos cuadras de la Plaza de Bolívar, lo convierte en una oportunidad excepcional para establecer tu negocio en una zona estratégica. ¡Contáctanos para más detalles y no pierdas la oportunidad de invertir en este local comercial!",Código Fincaraíz:,191273739,ATOS Inmobiliaria SAS,https://www.fincaraiz.com.co/local-en-venta/191273739,,
Finca,venta,Usado,"Tunja, Boyaca","Tunja, Los muiscas",22.00  m2 m²,¡Pregúntale!,¡Pregúntale!,$181.930.000,5,menor a 1 año,,", Cerca centro comercial, , Trans. Público cercano, , Zona Comercial, Descripción, Atos Inmobiliaria vende local con excelente ubicación, cerca de la zona universitaria y comercial. Cuenta con acabados de alta calidad, ideal para emprendedores e inversionistas que buscan una propiedad estratégica y atractiva. Aprovecha esta gran oportunidad para proyectar tu negocio en un sector de alto tráfico y crecimiento. Invierte con visión y asegura tu éxito. ¡Agenda tu cita hoy mismo!, Código Fincaraíz:, 192125014, Consultar, ATOS Inmobiliaria SAS, Completa tus datos para habilitar los medios de contacto, +57, Aceptas nuestros","Atos Inmobiliaria vende local con excelente ubicación, cerca de la zona universitaria y comercial. Cuenta con acabados de alta calidad, ideal para emprendedores e inversionistas que buscan una propiedad estratégica y atractiva. Aprovecha esta gran oportunidad para proyectar tu negocio en un sector de alto tráfico y crecimiento. Invierte con visión y asegura tu éxito. ¡Agenda tu cita hoy mismo!",,192125014,ATOS Inmobiliaria SAS,https://www.fincaraiz.com.co/local-en-venta/192125014,,
Casa,venta,Usado,"La fuente, Tunja, Boyaca","Bello horizonte, Tunja, San lazaro",120.00  m2 m²,3,2,$230.000.000,2,¡Pregúntale!,,", Cocina Integral, Descripción, Linda y cómoda casa con gran distribución, ubicada en la fuente etapa 4 consta de:  primer piso, sala, comedor, baño social  y parqueadero, En el segundo piso dos habitaciones, baño social  y estudio. En el tercer piso una habitación y patio de ropas amplio., Código Fincaraíz:, 10491076, Consultar, Inmobiliaria Fenix, Completa tus datos para habilitar los medios de contacto, +57, Aceptas nuestros","Linda y cómoda casa con gran distribución, ubicada en la fuente etapa 4 consta de:  primer piso, sala, comedor, baño social  y parqueadero, En el segundo piso dos habitaciones, baño social  y estudio. En el tercer piso una habitación y patio de ropas amplio.",,10491076,Inmobiliaria Fenix,https://www.fincaraiz.com.co/casa-en-venta/10491076,,
Lote,venta,Usado,"Tunja, Tunja, Boyaca","Tunja, Santa ana, La granja","13,250.00  m2 m²",¡Pregúntale!,¡Pregúntale!,$2.650.000.000,1,¡Pregúntale!,,,"Excelente lote ubicado en la autopista norte, comercial, residencial, institucional con servicos, cuenta con una area de 13.250 m2.",,191185260,Inmobiliaria Fenix,https://www.fincaraiz.com.co/lote-en-venta/191185260,,
Casa,venta,Usado,"Tunja, Boyaca","Tunja, Los rosales, Los cristales",60.00  m2 m²,2,2,$200.000.000,4,16 a 30 años,,", Calentador, , Canchas Deportivas, , Cerca centro comercial, , Instalación de gas, , Trans. Público cercano, , Zona Residencial, , Área Urbana, Descripción, Atos Inmobiliaria presenta en venta y arriendo un acogedor apartamento en el barrio Los Rosales, una ubicación privilegiada cerca de la UPTC. Este apartamento ofrece un diseño funcional que incluye una sala comedor espaciosa, dos habitaciones confortables, dos baños completos y un práctico estudio, ideal para trabajar o estudiar desde casa. Además, cuenta con una cocina bien equipada y una zona de ropas para mayor comodidad en las tareas del hogar. Con un área total de 60 m2, este apartamento es perfecto para parejas, familias pequeñas o estudiantes que deseen disfrutar de una vida tranquila y conveniente en una de las zonas más buscadas de la ciudad. ¡Contáctanos en Atos Inmobiliaria para más información sobre esta excelente oportunidad de venta o arriendo!, Código Fincaraíz:, 191273087, Consultar, ATOS Inmobiliaria SAS, Completa tus datos para habilitar los medios de contacto, +57, Aceptas nuestros","Atos Inmobiliaria presenta en venta y arriendo un acogedor apartamento en el barrio Los Rosales, una ubicación privilegiada cerca de la UPTC. Este apartamento ofrece un diseño funcional que incluye una sala comedor espaciosa, dos habitaciones confortables, dos baños completos y un práctico estudio, ideal para trabajar o estudiar desde casa. Además, cuenta con una cocina bien equipada y una zona de ropas para mayor comodidad en las tareas del hogar. Con un área total de 60 m2, este apartamento es perfecto para parejas, familias pequeñas o estudiantes que deseen disfrutar de una vida tranquila y conveniente en una de las zonas más buscadas de la ciudad. ¡Contáctanos en Atos Inmobiliaria para más información sobre esta excelente oportunidad de venta o arriendo!",Código Fincaraíz:,191273087,ATOS Inmobiliaria SAS,https://www.fincaraiz.com.co/apartamento-en-venta/191273087,,
Apartamento,venta,Usado,"Tunja, Boyaca","Tunja, Libertador, Obrero",104.00  m2 m²,3,2,$285.000.000,3,9 a 15 años,,,Apartamento Esquinero en Venta - Sur de Tunja,Código Fincaraíz:,191787426,ATOS Inmobiliaria SAS,https://www.fincaraiz.com.co/apartamento-en-venta/191787426,,
